{"content_boundary":{"contains_names":false,"contains_quotes":false,"contains_raw_text":false,"contains_relation_records":false,"contains_source_locators":false},"counts":{"accepted_private_review":12,"candidates_proposed":14,"draft_gold_cases":15,"held_for_entity_review":2,"human_gold_cases":0,"luna_gate_runs":0,"mechanically_located":14,"published_evidence_claims":0,"published_relations":0,"rejected":0,"sources":2},"generated_at":"2026-07-20","model_routing":{"backend_model_identifier_status":"not_exposed_by_runtime","extraction_role":"Terra","luna_used":false,"review_role":"Sol"},"report_version":"pilot-candidate-review-v1","review_method":"isolated-extraction-independent-review-v1","run_id":"run:pilot-terra-2026-07-20-v1","sources":[{"accepted_private_review":7,"candidates_proposed":8,"draft_gold_cases":7,"held_for_entity_review":1,"mechanically_located":8,"public_release_status":"blocked_rights_review","rejected":0,"source_id":"source:v2_fge_research_staff_pdf","source_sha256":"73ffc5f51e2c9aecfd88b117dde20ae0732c79b3872017e388e253df21f47e54","source_split":"validation"},{"accepted_private_review":5,"candidates_proposed":6,"draft_gold_cases":8,"held_for_entity_review":1,"mechanically_located":6,"public_release_status":"blocked_publisher_byte_reconciliation","rejected":0,"source_id":"source:v2_ikeda_koc_life_devoted_2003_pdf","source_sha256":"68680a0fa12b6e7f6aaff5f8201b7b4fb416161a07a973f9cf82f7a885708764","source_split":"pilot"}]}
